submission_id,posted_time_stamp,subreddit,title,url,author,upvotes,downvotes,article_text
ig9nhu,2020-08-25 13:38:37,JoeBiden,Republican DOJ appointees back Joe Biden,https://www.politico.com/news/2020/08/25/justice-department-against-trump-401279,bigbrother2030,1593,33,the officials said they’re backing biden in the hope of restoring “basic honesty and integrity to the us department of justice and to executive branch decisionmaking” “there’s no reasonable choice here at all trump is a person who is utterly unfit to serve i don’t want to be apocalyptic but if he were reelected then all of the tendencies that we’ve seen in the first term — and they keep getting scarier and scarier — would only get worse in terms of the militarization and peaceful protests and the use of the justice system to do whatever he wants” for his part trump has railed against democrats taking the reins at the justice department saying biden would radicalize the nation’s response to protests trump has said he is the president whose chief interest is maintaining law and order jeff flake speaks to the press on nov 28 2018 zach gibsongetty images the endorsement for biden and against trump from a cadre of republicans comes on the second day of the republican national convention on monday former sen jeff flake of arizona led more than two dozen former gop congressmen in forming “republicans for biden” to coincide with the launch of the convention other republican appointees to endorse biden on tuesday — alan charles raul who served as vice chair of the white house privacy and civil liberties oversight board under george w bush and served in roles with george hw bush as well as associate counsel to the president in the reagan administration — charles fried former us solicitor general in the reagan administration and an associate justice of the massachusetts supreme judicial court — stuart gerson an assistant attorney general under george h w bush — peter keisler former us acting attorney general under george w bush — paul rosenzweig who served in the department of homeland security under george w bush — robert shanks former us deputy assistant attorney general in the reagan administration — jw verret who served on trump’s presidential transition staff
hck45l,2020-06-20 13:39:49,JoeBiden,Trump Support Collapses In Rural America As Biden Gains 21 Points,https://www.politicususa.com/2020/06/19/biden-trump-rural-voters.html,,1580,66,545k shares facebook twitter whatsapp pinterest reddit print mail flipboard advertisements trump won rural voters by 30 points in 2016 but he has lost 21 points of rural support to joe biden in the latest fox news poll here is the fox news poll highlight mine trump’s support with rural voters was eroding long before the pandemic and the economic collapse trump’s supporters in rural america were hurt by his failed trade war with china they saw him do nothing about the opioid crisis he promised to bring american manufacturing back only to see those jobs not return trump attacked their healthcare and he boasted about a tax cut package that left out rural america but benefitted the wealthy and corporations advertisements as our own sarah jones put it the enthusiastic support for trump dimmed could be ashamed but still supporting over following – attacks on medicaremedicaid – tax cuts for the rich some larger biz signs down – charlottesville smaller household signs starting coming down – mueller investigation – corona — sarah reese jones politicussarah june 19 2020 if biden performs better with rural voters in states like pennsylvania and michigan than hillary clinton did he will flip places that trump carried and be in a position to win the election trump has whittled down his base of support to its core and played into the hands of joe biden biden has the potential to swing enough rural voters to send trump out of the white house and permanently to the golf course for more discussion about this story join our rachel maddow and msnbc group follow jason easley on facebook
ikk4v6,2020-09-01 16:21:34,JoeBiden,Cher raises $2 million for Biden at LGBTQ virtual fundraiser,https://www.washingtonblade.com/2020/08/31/cher-raises-2-million-for-biden-at-lgbtq-virtual-fundraiser/,progress18,1572,49,email share 139k shares cher raised 2 million for biden at an lgbtq fundraiser photo by machado cicala courtesy the karpel group “so ask yourself do you believe in life after trump” that was the question asked by cher paraphrasing the title of her iconic song at the virtual lgbtq fundraiser she headlined for joe biden on monday evening according to a pool report “hi it’s me” cher said at she appearing at end of the 30minute fundraiser on screen wearing a black leather biker jacket “your poster girl since i was 9 yearsold i walked into our living room and met two of the most adorable gay hairdressers ever” also appearing at the event was rep david cicilline dri the most senior openly gay member of congresss lesbian sen tammy baldwin dwis and pete buttigieg who made waves in the democratic primary as a gay presidential candidate cicilline said at the beginning of the event that it had raised nearly 2 million surpassing its original goal the campaign said there 500 attendees on the zoom call cher said she had known biden since 2006 when she invited herself to his office “he thinks he invited me but really i invited myself i saw a speech joe had given and it was love at first speech” “so i went to his office to grill him and i asked him really pointed questions and unlike most politicians joe actually listened to me and cared about what i had to say” cher said “he was honest and kind and smart” drawing a distinction between biden and trump cher said “joe is smart enough he’s kind enough he’s strong enough i also know that the person woman man camera tv in the white house is an idiot i mean it no the guy is really an idiot” cher — who has a transgender son actor chaz bono — pointed to the trump administration’s policies negatively affecting transgender people namechecking the military ban as well as regulations abolishing protections for transgender people in health care and homeless shelters “after all this trump has the audacity to say he supports americans he calls quote ‘the gays’ i’m surprised he doesn’t call them his ‘gay generals’” cher said biden dressed in the same blue suit he wore earlier in the day at the event in philadelphia joined the call and noted gay rep sean patrick maloney dny was there “i tell you what you’re dragging in new york to make sure we get things done” mr biden said in jest “is that the idea” biden recommitted himself to signing the equality act into law within 100 days as president lamenting senate majority leader mitch mcconnell rky has refused to bring up the legislation for a vote “when i’m president that changes i’ll make signing the equality act one of the top priorities of my first 100 days” biden said adding he’d seek to “build a nation where everybody everybody is finally not only created equal but treated equally as well” biden then recognized mr buttigieg citing his “enormous integrity” and “physical courage as a naval officer and moral courage as a leader” he also thanked “from a distance cher she first supported us way back last winter when it took some guts to do so fortunately guts are something cher has in abundance” repeating his remarks from earlier in the day at the philadelphia speech biden said reiterated “rioting is not protesting all it does is hurt the communities businesses and families that are already reeling from the injustices that existed as the reason for the protesting it doesn’t advance the cause it makes things worse not better and it’s wrong” cher also spoke of biden’s record on lgbtq issues such as gay marriage and the repeal of “don’t ask don’t tell” predicting progress would continue if he were the candidate were elected president “as president joe will build on this progress reversing destructive policies of the putin i mean trump administration” she said making a joke about trump’s perceived affinity for the russian president and refusal to condemn him other speakers at the event also denounced trump and praised biden among them was baldwin who said trump was stoking divisions “especially in my home state of wisconsin where we have seen tragedy and heartbreak in kenosha wis that this current president has only tried to stir it up and make it worse” “we need at this moment joe biden’s leadership his compassion and empathy and his unity and hope” baldwin said
j0plgh,2020-09-27 14:30:17,JoeBiden,I was a Republican governor of Pa. I’m voting for Joe Biden.,https://www.inquirer.com/opinion/commentary/tom-ridge-trump-biden-election-2020-vote-20200927.html,Darth_Deckard,1525,31,compare and contrast that with the crisis of today imagine the impact of president trump traveling to the centers for disease control and prevention back in february and talking plainly about the challenge mother nature intended to throw at us and how this country working together public and private sector would confront it with all the fortitude and resources we could bring to bear then imagine him meeting with journalists the next day appearing with a face mask and calmly walking through the steps that his fellow citizens could and should take to do their part to combat this new challenge imagine the difference in attitude and outcomes perhaps i have more trust in americans being able to handle the truth than the president
ia68oc,2020-08-15 15:10:29,JoeBiden,Harris 'electrifies' West Indian voters — and gives Biden a new edge in Florida,https://www.politico.com/news/2020/08/15/kamala-harris-west-indian-voters-395554,norma_clyde,1513,63,“it was all black women out there working under the tents” she said “it was 98 degrees in august in south florida so it was too hot to cheer but you could feel it this sense” that feeling stretches beyond the jamaicanamerican community and the more traditional african american community shared by those in south florida with roots in haiti the bahamas trinidad and tobago or guyana they comprise a growing and varied black west indian diaspora community a littlediscussed but increasingly influential slice of the electorate of the nation’s biggest swing state while exact numbers are hard to come by census estimates and political studies peg the diverse black community — nicknamed the caribbean massive by some — at more than 25 million including hundreds of thousands of florida voters that’s crucial in a battleground state where elections are often decided by less than a percentage point for a campaign thats been dogged by questions of lackluster enthusiasm since biden declared his candidacy 16 months ago the electricity sparked by the harris pick has produced tangible results the campaign reported raising a record 48 million in 48 hours pollsters logged an uptick of support for biden who was already leading donald trump — including in the president’s mustwin state “it’s the pick that’s going to energize us it’s the pick that’s getting us motivated” said karen andre one of biden’s top advisers in florida who’s of haitianamerican descent she said the campaign plans “a full 360 degree effort” to engage caribbeanamerican voters including with paid radio ads in creole and english and possible interviews with harris with local hosts who have audiences with roots in the west indies andre said that after the harris announcement her phone was “burning” with calls from jamaicanamericans and also “heard from haiti trinidad barbados bahamas” at the same time the independent bidenbacking super pac unite the country is considering its own program aimed at black caribbean voters the pac is led by veteran florida operative steve schale who noticed a drop off in enthusiasm among these voters when hillary clinton unexpectedly lost the state to trump in 2016 even republicans acknowledge harris could have an effect “there is a very tight connection between haitian americans in south florida and jamaican americans in south florida” said hans mardy a haitianamerican republican activist from miami “we are one when it comes to our struggle we fought the same war we have the same bible what is good for one immigrant is good for us all” mardy like many haitianamericans said he’s struggling to support trump after he called the island a “shithole” democrats are determined not to let the community forget about it or trump’s hardline immigration policies that have particular salience in south florida mardy said his three adult daughters are all excited about voting for biden with harris on the ticket another creole plus for harris her campaign’s chief of staff is a wellknown daughter of the community karine jeanpierre eddy edwards host of the popular “caribbean riddims” am radio show for 36 years in broward said “there’s a buzz in the air” over harris still there isn’t perfect alignment between the haitian and jamaican diaspora communities in the state the haitian community is larger has a creolespeaking culture and is clustered more in north miamidade county jamaicanamericans’ ancestral island is a former english colony and they’ve made broward county their home clustering heavily in cities like lauderhill and miramar where the entire city council and mayor have jamaican ancestry nine months ago dale holness became the first jamaicanborn mayor of broward the secondmost populous in the state the west indian influence in broward county is so strong that the international cricket council sanctioned a new fort lauderdale stadium the project manager is chandradath singh a broward resident who was trinidad and tobago’s consul in miami before serving as the nation’s ambassador to india and china singh estimated florida has more than 2 million people with roots in the englishspeaking west indies and harris’ indian ancestry on her mother’s side gives her added salience in the caribbean many indians were brought to the west indies as indentured servants after slavery ended “biden’s history as vice president for barack obama was wellreceived by the community but now i see greater enthusiasm and support” singh said dan smith a university of florida professor studied the state’s voter rolls in 2018 and found there were at least 115000 florida voters born in haiti and 91000 born in jamaica the total number of us born voters who identify as haitianamerican jamaicanamerican or trace roots to other islands in the west indies is likely far higher the nonprofit migration policy institute estimates there are at least 336000 members of the jamaican diaspora community in florida 528000 haitianamericans 56000 with roots in trinidad and 7000 barbadian diaspora members the focus on these black voters and communities broadens the discussion of florida’s voters from the caribbean which usually focuses most heavily on those with roots in spanishspeaking cuba and puerto rico levi williams a republican activist and former school board candidate who’s of jamaican descent said that while black voters tend to vote democratic there’s a conservative group of voters who don’t like biden’s politics williams acknowledged that harris could drive higher turnout among black caribbeanamerican voters but he was skeptical the biden campaign would pull it off he pointed out that biden suggested recently that there was little diversity in the africanamerican community “caribbeans don’t consider themselves black in the american sense” williams said “a jamaican is a jamaican a haitian is a haitian and a trinidadian is a trinidadian you can’t place on that community the black experience in america” but marlon hill a miamidade county commission candidate said he considers himself africanamerican and jamaican he said harris who attended historically black howard university and was a member of the alpha kappa alpha sorority “appeals to the broadest definition of blackness in america in 2020 when you think of someone who is black you can think of their heritage of the state that they’re from and you have to think of their parents or the school that they went to being black is not singular in america in 2020” karen green chair of the florida democratic party’s diversity and inclusion committee said harris’ background creates a stark contrast with trump “she’s a universal woman of our modern times she serves as a woman who refutes everything trump stands for” green said “i’m going to be an evangelist for her and there are thousands like me”
gxinpd,2020-06-06 05:35:03,JoeBiden,Biden formally clinches Democratic presidential nomination,https://apnews.com/bb261be1a4ca285b9422b2f6b93d8d75?utm_medium=AP&utm_source=Twitter&utm_campaign=SocialFlow,TyrannoTwilight,1507,206,file in this march 12 2020 file photo democratic presidential candidate former vice president joe biden speaks about the coronavirus in wilmington del biden has won the last few delegates he needed to clinch the democratic nomination for president ap photomatt rourke file file in this march 12 2020 file photo democratic presidential candidate former vice president joe biden speaks about the coronavirus in wilmington del biden has won the last few delegates he needed to clinch the democratic nomination for president ap photomatt rourke file washington ap — joe biden formally clinched the democratic presidential nomination friday setting him up for a bruising challenge to president donald trump that will play out against the unprecedented backdrop of a pandemic economic collapse and civil unrest “it was an honor to compete alongside one of the most talented groups of candidates the democratic party has ever fielded” biden said in a statement friday night ”and i am proud to say that we are going into this general election a united party” the former vice president has effectively been his party’s leader since his last challenger in the democratic primary bernie sanders ended his campaign in april but biden pulled together the 1991 delegates needed to become the nominee after seven states and the district of columbia held presidential primaries tuesday advertisement biden reached the threshold three days after the primaries because several states overwhelmed by huge increases in mail ballots took days to tabulate results a team of analysts at the associated press then parsed the votes into individual congressional districts democrats award most delegates to the party’s national convention based on results in individual congressional districts biden now has 1995 delegates with contests still to come in eight states and three us territories the moment was met with little of the traditional fanfare as the nation confronts overlapping crises while biden has started to venture out more this week the coronavirus pandemic has largely confined him to his wilmington delaware home for much of the past three months the country faces the worst rate of unemployment since the great depression and civil unrest that harkens back to the 1960s has erupted in dozens of cities following the death of george floyd a black man who died when a white minneapolis police officer pressed his knee into floyd’s neck for several minutes even after he stopped moving and pleading for air it’s a confluence of events that no us leader has faced in modern times made all the more complicated by a president who has at times antagonized the protesters and is eager to take the fight to biden “this is a difficult time in america’s history” biden said friday night “and donald trump’s angry divisive politics is no answer the country is crying out for leadership leadership that can unite us leadership that can bring us together” advertisement biden spent 36 years in the senate before becoming barack obama’s vice president this is 77yearold biden’s third bid for the presidency and his success in capturing the democratic nomination was driven by strong support from black voters he finished an embarrassing fourth place in the overwhelmingly white iowa caucuses that kicked off the nomination process in february biden fared little better in the new hampshire primary where his standing was so low that he left the state before polls closed on election night to instead rally black voters in south carolina his rebound began in the more diverse caucuses in nevada but solidified in south carolina where biden stomped sanders his nearest rival by nearly 29 points he followed that with a dominant showing three days later during the super tuesday contests taking 10 of the 14 states biden’s strong showing in states such as north carolina virginia tennessee and texas reinforced his status as the preferred democratic candidate of african american voters — but the relationship has not been without its strained moments after a tense exchange with an influential black radio host biden took sharp criticism for suggesting that african american voters still deciding between him and trump “ain’t black” that comment and protests that have spread nationwide have increased pressure on biden to pick an african american running mate he has already committed to picking a woman as a vice presidential candidate black voters are unlikely to back trump over biden by a wide margin a recent fox news poll shows just 14 of african americans who are registered to vote have a favorable opinion of the president compared with 75 who favorably view biden but biden must ensure that black voters are motivated to show up to the polls in november especially in critical swing states that narrowly went for trump in 2016 at one point the democratic primary included dozens of candidates of different races genders and generations and an openly gay man the contest was dominated by debate over unapologetically progressive ideas including fully governmentfunded health care under “medicare for all” and a sweeping proposal to combat climate change known as the “green new deal” biden prevailed by mostly offering more moderate approaches that he argued would make him more electable against trump he refused to budge on his rejection of universal health care and some of the green new deal’s most ambitious provisions to combat climate change since clinching the nomination however biden has worked to build his appeal among progressives forming joint task forces with sanders’ campaign to find common ground on key issues like health care the economy and the environment biden has also embraced a plan to forgive millions of americans’ student debt meaning that he clinches the nomination as easily the most liberal standard bearer the democratic party has ever had biden’s embrace of his party’s left flank could help him consolidate a democratic base that remained deeply divided after the 2016 primary and ultimately hurt hillary clinton in her defeat to trump but it could also undermine biden’s attempts to rebuild the obama coalition which is often loosely defined as minorities and young people as well as educated americans and some workingclass voters the former vice president has sought since announcing his candidacy to cast the election as a battle “for the soul of the nation” and promised to restore order and dignity to the white house while rehabilitating the us image on the world stage such an approach though necessarily focuses on being more of an alternative to trump than offering radically new political ideas and that further underscores biden’s difficult task of trying to unite his party’s base while appealing to voters from far beyond it “i am going to spend every day between now and november 3rd fighting to earn the votes of americans all across this great country” biden promised friday “so that together we can win the battle for the soul of this nation and make sure that as we rebuild our economy everyone comes along”
