submission_id,posted_time_stamp,subreddit,title,url,author,upvotes,downvotes,article_text
k1g4pi,2020-11-26 16:29:15,JoeBiden,Thankful,https://youtu.be/IWhBsZ7bDFk,6677wyy,1220,25,
htmdmv,2020-07-18 22:20:54,JoeBiden,Donald Trump was warned about a pandemic 3 months before Covid struck: Report,https://www.indiatoday.in/world/story/donald-trump-coronavirus-pandemic-united-states-warning-covid-deaths-1702041-2020-07-19,,1216,25,could us president donald trump have known about the an impending coronavirus pandemic as early as september 2019 a top economist who worked with the white house says yes in september 2019 as the world lived on unsuspecting of the novel coronavirus a team of top economists in the donald trump administration had warned the us president about the looming dangers of a pandemic outbreak the team had reportedly alerted the white house about an oncoming pandemic and presented a 41page report but the advice was not heeded to todas philipson an economist who served for three years as the acting chairperson of the trump administrations council of economic advisers cea made this sensational revelation to cnn on friday according to cnn philipson said his team alerted the white house about the dangers of a looming flulike pandemic outbreak about three months before covid19 is believed to have made its way into the united states philipson said the report had warned a pandemic disease could kill as many as half a million americans and cause up to 379 trillion in damage to the us economy philipson stepped down from his post in june this year and returned to his teaching role at the university of chicago he had reportedly tested positive for covid19 a month before his departure from the white house speaking to cnn on friday todas philipson said he was one of the coauthors that published a report titled mitigating the impact of pandemic influenza through vaccine innovation this revelation from one of president trumps key economists is important because the us president so far has insisted that it was not possible to foresee or prevent the coronavirus pandemic contrary to the presidents claim the 41page report prepared by philipsons team was presented to senior white house officials in september 2019 itself while the first few cases of novel coronavirus were detected in wuhan china in middecember and the world health organisation was informed about the viral infection in december end speaking to cnn philipson acknowledged that this report was presented to president trump or his top white house officials the white house is fully aware of what cea puts out he was quoted as saying by cnn meanwhile as per the latest who data the us today has the highest number of covid19 cases and deaths cities after cities and states after states have suffered massive loss of life and income due to the coronavirus pandemic and resultant lockdown in the us as of july 18 the total number of people testing positive for covid19 in the us had reached 3544143 of these 137674 have died so far also read covid is airborne what does it mean who chief scientist dr soumya swaminathan explains also read coronavirus vaccines in human trials all you need to know about clinical studies also read what doctors know about coronavirus and its treatment after 6 months of global pandemic also watch covid is airborne but in very limited environment who chief scientist dr soumya swaminathan
hj8y8z,2020-07-01 15:07:41,JoeBiden,"Biden says Trump doesn't seem ""cognitively aware"" of Russia bounty intel",https://www.cbsnews.com/news/biden-trump-russia-bounty-intelligence-aware/,progress18,1220,25,presumptive democratic presidential nominee joe biden rebuked president trump on tuesday over reports that sensitive intelligence about a russian spy agency offering bounties to afghan militants to kill us and coalition forces was included in the presidents briefing material months ago though he said the story is still developing biden told reporters in wilmington delaware that its an absolute dereliction of duty if any of this is even remotely true adding i think the president has a lot to answer for and we should get the answers quickly this president talks about cognitive capability he doesnt seem to be cognitively aware of whats going on biden said apparently in reference to mr trumps attacks on bidens cognitive abilities he either reads andor gets briefed on important issues and he forgets it or he doesnt think its necessary that he need to know it get breaking news delivered to your inbox biden said that upon learning about the allegations mr trump should have gotten to the bottom of the reports assembled the joint chiefs of staff and asked what theyre doing to prevent this democratic presidential candidate joe biden speaks on on june 30 2020 in wilmington delaware photo by brendan smialowskiafp via getty images the former vice president said mr trump should have at a minimum picked up the phone and said vladimir old buddy if any is true youve got a big problem a big problem the new york times and associated press reported monday that the bounty allegations were included in at least one of the presidents written daily intelligence briefings known as the presidential daily brief the presidential daily brief is something i read every single day as vice president president obama read it every day i was briefed every morning before i got to the white house biden said adding so the idea that somehow he didnt know or isnt being briefed — it is a dereliction of duty if thats the case and if he was briefed and nothing was done about this thats a dereliction of duty biden was in wilmington to deliver a speech laying out what he would do to bring the coronavirus pandemic under control in terms of testing tracing working with experts and promoting the use of masks to slow the virus spread he also criticized mr trump for his handling of the crisis which has lately seen a sharp rise in cases in several states now its almost july and it seems the wartime president has surrendered has waved the white flag and left the field of battle biden said slamming the president because he gives us no direction and pits us against one another dr anthony fauci one of the countrys top infectious disease experts told congress earlier in the day that the us is going in the wrong direction clearly we are not in total control right now he said if trends arent reversed the numbers could get much worse fauci said suggesting new cases each day could reach 100000 in bidens view whats missing is a unified response to the virus and he criticized the trump administrations decision to allow states to decide for themselves how to arrest the spread of the virus whatever it is that were doing now its not working a statebystate approach will only produce confusion and slow any progress biden said we cant continue on like this — half recovering and half getting worse biden said we cant continue — half wearing masks and half rejecting science we cant continue — half with a plan and half just hoping for the best the virus wont be eliminated with a piecemeal approach — lifting restrictions prematurely he said after his speech biden took questions from reporters about his campaign plans the former vice president said he would not be holding rallies for the time being though he said he would rather be out there with people he also said that the hard vet of running mate candidates is just underway and will take about six to eight weeks to complete asked about whether he has a list of supreme court nominees biden said he would not reveal it until the candidates have been vetted on the question of the three debates he has agreed to participate in with mr trump in the fall biden said i can hardly wait to compare my cognitive capability to the cognitive capability of the man im running against melissa quinn and sarah ewallwice contributed to this report
iyw4va,2020-09-24 15:16:50,JoeBiden,Texas shatters voter registration records again as Trump-Biden election draws closer,https://www.houstonchronicle.com/politics/texas/article/Texas-voter-registration-surges-trump-biden-record-15586286.php,justanotherlidian,1209,12,texas has once again shattered vote registration records adding more than 15 million voters since the last presidential election texas now has surpassed 166 million voters according to the latest numbers announced tuesday by texas secretary of state ruth r hughs and there are still almost two weeks to add more “ahead of the november election i encourage all eligible texans who have not already done so to register to vote by oct 5 so that they can help shape the future of the lone star state” hughs said in the four previous presidential election cycles texas added about 700000 new voters on average — less than half as many as have been added this cycle indepth texas voter registration hits 164m despite pandemic that fast growth in voters adds another wrinkle to texas politics that already have been shifted by the pandemic campaigns don’t know how those voters are going to break or even if they are going to show up to vote at all said brandon rottinghaus a university of houston political science professor “it brings a lot of uncertainty” rottinghaus said that includes guessing whether they’ll show up by election day it’s much harder to mobilize firsttime voters and get them to the polls rottinghaus said ted cruz ‘texas is a battleground’ the surge of voters comes as political experts begin to question if democrats can break a decadeslong slump in texas no democratic presidential candidate has won texas since 1976 but recent polls suggest president donald trump is in a tight race to keep texas from former vice president joe biden the last two public polls of texas voters show trump holding a 2 percentage point lead over biden with early voting getting underway in three weeks nobody doubts that the democrats have gained ground in the last four years republicans acknowledge that while the gop was counting on a more organic growth of voters democrats and their allies were aggressively adding voters at a faster clip the result was democrats flipping 12 seats in the texas house in the 2018 midterm elections along with two congressional seats us senate candidate beto o’rourke came within 220000 votes of becoming the first democrat to win statewide office since 1994 the blue spine voter registration grows at faster clip along interstate 35 over the last two years the gop has responded by being more aggressive in its own voter registration programs upgrading its candidate recruitment efforts and improving its fundraising still us sen ted cruz has told republicans in texas they need to brace for another tough battle like nothing they’ve seen before he said the democrats who showed up in texas in 2018 are fired up again and even more determined to take out trump “texas is a battleground” cruz told supporters on a conference call last week a third of growth occurred in three deepblue counties texas does not require voters to pick a party to register but voter registration growth in various regions has given both democrats and republicans cause to be optimistic going into november about onethird of the new voters since november 2018 come from three counties harris travis and bexar — all deeply blue since 2016 that has democrats convinced that they are adding to their base of support but for republicans voter registration has been surging in places such as bell williamson denton collin and montgomery counties — suburban communities that trump carried in 2016 the surge in voter registration over the last four years is even eclipsing the state’s population growth while texas has seen its population grow an estimated 5 percent in four years voter registration has increased by over 10 percent texas voter registration november 2012 13646226 november 2014 14025441 november 2016 15101087 november 2018 15793257 march 2020 16211198 now 16617436 source texas secretary of state are you registered to vote in the november presidential election new voters must register by oct 5 voters who are not sure if they are registered can check online at wwwvotetexasgov oct 5 is also the deadline to change the address on a voter registration address changes made within the same county are effective 30 days afterward voters who move to a new county must submit a new voter registration application people also can register to vote with the local county voting registrar in harris county voters can apply with the harris tax assessorcollector voter registrar office by calling 713 2748200 or visiting wwwhctaxnet in bexar county voters can submit an application with the bexar county elections department call 2103358683 or visit wwwbexarorg
i2bi0p,2020-08-02 15:47:35,JoeBiden,Joe Biden campaign planning statewide push in Ohio this week,https://www.cleveland.com/open/2020/08/joe-biden-campaign-planning-statewide-push-in-ohio-this-week.html,progress18,1207,50,cleveland ohio – as the national landscape has expanded the map in the presidential race the campaign for democratic former vice president joe biden is making a bigger push in ohio that includes the start this week of a virtual tour focusing on more rural areas featuring local officials across the state to counter republican president donald trump’s scheduled aug 6 fundraiser in bratenahl once seen as a state firmly in trump’s column biden has also begun staffing up and spending on television ads as polling shows a more competitive race the biden camp will focus on the lagging economy caused by coronavirus in a bid to flip the state that trump won in 2016 by 450000 votes “on our ‘made in america’ tour we’ll speak directly to working families across ohio who have had enough of donald trump’s broken promises and who are ready for a president who will fight for workers and families not just the wealthy and wellconnected” said toni webb the biden campaign’s state director the virtual tour will start tuesday in kent featuring portage county commissioner kathleen clyde chillicothe mayor luke feeney will host a virtual roundtable on wednesday with lima mayor david berger hosting one thursday sen sherrod brown will wrap up the tour with a cleveland roundtable on friday the roundtables will heavily focus on economic and manufacturing issues highlighting what they described as broken promises by the trump campaign manufacturing job growth stalled even before the pandemic and coronavirus has sent both the state and nation into a recession the unemployment rate in the stood at 109 in june according to preliminary figures from the us bureau of labor statistics the tour comes less than a week after biden began running television ads in the toledo and youngstown market an indicator that they’re considering the state more viable as trump’s approval ratings remain low prior to the coronavirus pandemic many democrats thought ohio would be an afterthought for any presidential campaign with states such as michigan wisconsin pennsylvania florida arizona north carolina and georgia as higher priorities for the democratic nominee to reach 270 electoral votes however the deluge of crises facing the country since february have shifted the dynamics of the race drastically polls routinely show a close race between trump and biden in ohio the first presidential debate on sept 29 will also be held in cleveland after the university of notre dame dropped out of hosting meanwhile the trump campaign – aware of that the president’s chances of reelection are essentially nonexistent without carrying ohio – have been spending frequently in the state that includes reserving more than 18 million in fall television advertisements a hefty amount indicative that the campaign is preparing for a competitive environment read more politics coverage house passes bill to fund great lakes projects and numerous federal departments fbi agents raid exhouse speaker larry householder’s legislative office ohio liquor commission adopts rule gov mike dewine signs executive order ending alcohol sales statewide at 10 pm ohio democratic party relents on controversial ppp loan as legislation is introduced to require a giveback
jzt4c2,2020-11-24 01:22:51,JoeBiden,AP source: US agency allows formal Biden transition to begin,https://apnews.com/article/joe-biden-health-national-security-rob-portman-coronavirus-pandemic-ac923137dfb664e5c3a1923f52eebbad,progress18,1198,12,file in this june 21 2019 file photo general services administration administrator emily murphy speaks during a ribbon cutting ceremony for the department of homeland securitys st elizabeths campus center building in washington the head of the obscure federal government agency that is holding up joe bidens presidential transition knew well before election day she might have a messy situation on her hands well prior to nov 3 gsa administrator emily murphy held a zoom call with dave barram 77 a man who was in her shoes 20 years earlier during the contested 2000 election between george w bush and al gore barram said he gave her some simple advice “if you do the right thing then all you have to do is live with the consequences of it’”ap photosusan walsh file in this june 21 2019 file photo general services administration administrator emily murphy speaks during a ribbon cutting ceremony for the department of homeland securitys st elizabeths campus center building in washington the head of the obscure federal government agency that is holding up joe bidens presidential transition knew well before election day she might have a messy situation on her hands well prior to nov 3 gsa administrator emily murphy held a zoom call with dave barram 77 a man who was in her shoes 20 years earlier during the contested 2000 election between george w bush and al gore barram said he gave her some simple advice “if you do the right thing then all you have to do is live with the consequences of it’”ap photosusan walsh washington ap — the general services administration ascertained monday that presidentelect joe biden is the “apparent winner” of the nov 3 election clearing the way for the start of the transition from president donald trump’s administration and allowing biden to coordinate with federal agencies on plans for taking over on jan 20 trump who had refused to concede the election said in a tweet that he is directing his team to cooperate on the transition but is vowing to keep up the fight administrator emily murphy made the determination after trump efforts to subvert the vote failed across battleground states citing “recent developments involving legal challenges and certifications of election results” michigan certified biden’s victory monday and a federal judge in pennsylvania tossed a trump campaign lawsuit on saturday seeking to prevent certification in that state yohannes abraham the executive director of the biden transition said in a statement that the decision “is a needed step to begin tackling the challenges facing our nation including getting the pandemic under control and our economy back on track” he added “in the days ahead transition officials will begin meeting with federal officials to discuss the pandemic response have a full accounting of our national security interests and gain complete understanding of the trump administration’s efforts to hollow out government agencies” murphy a trump appointee had faced bipartisan criticism for failing to begin the transition process sooner preventing biden’s team from working with career agency officials on plans for his administration including in critical national security and public health areas “please know that i came to my decision independently based on the law and available facts i was never directly or indirectly pressured by any executive branch official—including those who work at the white house or gsa—with regard to the substance or timing of my decision” murphy wrote in a letter to biden trump tweeted shortly after her letter was made public “we will keep up the good fight and i believe we will prevail nevertheless in the best interest of our country i am recommending that emily and her team do what needs to be done with regard to initial protocols and have told my team to do the same” pressure had been mounting on murphy as an increasing number of republicans national security experts and business leaders said it was time for that process to move forward retiring tennessee sen lamar alexander who has repeatedly called for the transition to begin released a new statement monday saying that trump should “put the country first” and help biden’s administration succeed “when you are in public life people remember the last thing you do” alexander said republican sen rob portman of ohio on monday called for murphy to release money and staffing needed for the transition portman a senior member of the senate homeland security and governmental affairs committee also said biden should receive highlevel briefings on national security and the coronavirus vaccine distribution plan alexander and portman who have both aligned themselves with trump joined a growing number of republican officials who in recent days have urged trump to begin the transition immediately sen shelley moore capito rwva also urged a smooth transition saying in a statement monday that “at some point the 2020 election must end” meanwhile more than 160 business leaders asked murphy to immediately acknowledge biden as presidentelect and begin the transition to a new administration “withholding resources and vital information from an incoming administration puts the public and economic health and security of america at risk″ the business leaders said in an open letter to murphy advertisement separately more than 100 republican former national security officials — including former homeland security director tom ridge former cia director michael hayden and former director of national intelligence john negroponte — said in a statement that trump’s refusal to concede and allow for an orderly transition “constitutes a serious threat” to america’s democratic process the officials signing the letter worked under four republican presidents including trump the statement called on “republican leaders — especially those in congress — to publicly demand that president trump cease his antidemocratic assault on the integrity of the presidential election” trump had publicly refused to accept defeat and launched a series of losing court battles across the country making baseless claims of widespread voter fraud and seeking to overturn the election results murphy missed a deadline on monday set by house democrats to brief lawmakers about the delay in beginning the transition which is usually a routine step between the election and the inauguration a spokeswoman for the gsa said that a deputy administrator would instead hold two separate briefings for house and senate committees on nov 30 in response the democratic chairs of four committees and subcommittees said they could reschedule the meeting for tuesday but no later “we cannot wait yet another week to obtain basic information about your refusal to make the ascertainment determination” the democrats said in a letter to murphy “every additional day that is wasted is a day that the safety health and wellbeing of the american people is imperiled as the incoming bidenharris administration is blocked from fully preparing for the coronavirus pandemic our nation’s dire economic crisis and our national security” portman said it was “only prudent” for gsa to begin the transition process immediately “donald trump is our president until jan 20 2021 but in the likely event that joe biden becomes our next president it is in the national interest that the transition is seamless and that america is ready on day one of a new administration for the challenges we face″ portman wrote in an oped calling for the transition to begin murphy’s ascertainment will free up money for the transition and clear the way for biden’s team to begin placing transition personnel at federal agencies trump administration officials had said they would not give biden the classified presidential daily briefing on intelligence matters until the gsa makes the ascertainment official “now that gsa administrator emily murphy has fulfilled her duty and ascertained the election results the formal presidential transition can begin in full force” said max stier president and ceo of the nonpartisan partnership for public service “unfortunately every day lost to the delayed ascertainment was a missed opportunity for the outgoing administration to help presidentelect joe biden prepare to meet our country’s greatest challenges the good news is that the presidentelect and his team are the most prepared and best equipped of any incoming administration in recent memory” among those signing the letter from business leaders were jon gray president of the blackstone private equity firm robert bakish president and ceo of viacomcbs inc henry kravis the cochief executive of kohlberg kravis roberts co another private equity giant david solomon ceo at goldman sachs and george h walker ceo of the investment firm neuberger berman and a second cousin to former president george w bush
