submission_id,posted_time_stamp,subreddit,title,url,author,upvotes,downvotes,article_text
i7zagl,2020-08-11 23:21:20,JoeBiden,Joe Biden has picked Kamala Harris as his running mate,https://joebiden.com/wp-content/uploads/2020/08/cine.png,progress18,16838,7924,
j7cauh,2020-10-08 15:40:39,JoeBiden,"Surprise, surprise. After saying Joe Biden will pull out of debates, Trump has pulled out of debates. ""I'm not going to waste my time"".",https://www.cnbc.com/2020/10/08/second-presidential-debate-between-trump-and-biden-on-oct-15-will-be-virtual.html,IrishGuyNYC00,6858,286,washington — president donald trump on thursday said he would not participate in his second official presidential debate with democratic nominee joe biden after the bipartisan presidential debate commission shifted the event format from a inperson townhall to a virtual one no im not going to waste my time on a virtual debate he said during an interview thursday morning on the fox business channel his campaign later said trump will hold a rally that night instead the second of three presidential debates this fall was originally slated to take place in miami florida on oct 15 both the biden and trump campaigns had agreed to the date location and format back in june then last friday trump announced that he and first lady melania trump had tested positive for the coronavirus since then more than a dozen white house officials have tested positive for covid19 citing a need to protect the health and safety of all involved the debate commission announced thursday morning that the miami debate would remain in a townhall format but that candidates would participate from separate remote locations trump and his allies quickly claimed without evidence that the commission had made the change to favor biden a biden campaign source told nbc news that the cpd made the decision independently over the course of the day thursday the biden and trump campaigns issued a flurry of competing proposals for what should happen next following trumps refusal to do a virtual debate the biden campaign proposed that the third and final debate currently scheduled for oct 22 be held as a townhall debate instead of just the two men and a moderator the trump campaign tentatively agreed to a townhall on oct 22 but then they demanded a third and final debate on oct 29 arguing that an oct 22 town hall was essentially a rescheduling of next weeks debate the biden campaign rejected the idea of adding another debate day noting that it was trump not biden who blew up the oct 15 debate by refusing to participate under the rules set by the commission on thursday afternoon abc news announced that biden had agreed to do a town hall with the network on oct 15 in pennsylvania effectively closing the door to additional negotiations trump however wasnt finished negotiating at around 700 pm et the white house released a memo from trumps physician sean conley saying that he expected the president could make a safe return to public engagements this saturday exactly 10 days after trump was first diagnosed with covid19 citing the latest memo trumps campaign then put out a statement arguing that there was no medical reason why the commission on presidential debates should shift the oct 15 debate to a virtual setting postpone it or otherwise alter it in any way but experts say it can be difficult to pinpoint exactly when a covid patient is no longer contagious and they urge doctors and patients to err on the side of caution
j4yn2h,2020-10-04 16:06:35,JoeBiden,Biden's national lead over Trump jumps to 14 points after debate in NBC News/WSJ poll,https://www.nbcnews.com/politics/meet-the-press/biden-s-national-lead-over-trump-jumps-14-points-after-n1242018,DrBrotatoJr,6193,466,washington — joe bidens national lead over president donald trump nearly doubled after tuesdays presidential debate with voters saying by 2to1 that biden has the better temperament to be president according to a new nbc newswall street journal poll the poll was conducted in the two days after the unruly and insultfilled debate tuesday but before trump tested positive for covid19 and was hospitalized friday at walter reed national military medical center biden is now ahead of trump by 14 points among registered voters 53 percent to 39 percent — up from his 8point lead in the previous poll before the debate the 14point advantage represents bidens largest lead in the nbc newswsj poll during the entire campaign his previous high was 11 points in july the clear loser from the debate was donald trump said democratic pollster jeff horwitt of hart research associates who conducted the survey with republican pollster bill mcinturff of public opinion strategies and at least for the short term this has damaged his standing against joe biden horwitt added but mcinturff the republican pollster cautioned that the survey could represent a shock to the system right after a consequential debate democrats for example hold a 9point advantage in party identification in the poll compared to 5 to 6point advantages in previous ones as a result mcinturff said the race could return to the stable 8 to 9point margin it has essentially been at over the last several months — which is still a difficult place for an incumbent four weeks before election day the biggest declines for trump were among seniors who now back biden by 62 percent to 35 percent and suburban women 58 percent to 33 percent and men 50 years and older moved to a 1point advantage for biden in the latest poll compared to a 13point advantage for trump in the predebate nbc newswsj poll voters say biden did a better job at the debate by 2to1 fortynine percent of voters say biden did a better job at tuesdays debate which was marked by insults interruptions falsehoods and personal attacks — most although not all coming from the president thats compared with 24 percent who say trump did better another 17 percent say neither did a better job in addition 19 percent of voters say theyre more likely to support biden after the debate compared to 6 percent who say theyre more likely to back trump the vast majority — 73 percent — say the debate made no difference in how theyd vote among the 49 percent who say biden did a better job many voters cited trumps performance when asked to describe what they thought was important at the debate basically last night was a snapshot of the last three and a half years not being able to say anything about white supremacists being negative and being unpresidential one respondent said another voter who thought biden did a better job said i just think it was the same old trump he was bullying even among the 24 percent who say trump did the better job the responses were as much about the presidents performance as bidens i would say donald trumps admittance of not supporting white supremacists telling the white supremacists to stand down so to speak by the moderator the other important thing was joe bidens inability to form any coherent response said a voter who thought trump did a better job democratic pollster peter hart summing up the voter responses said its trumps debate not bidens debate bidens presidential temperament advantage the new poll also finds biden holding a whopping 32point advantage on which candidate has the better temperament to be president with 58 percent of voters picking biden compared to 26 percent picking trump that margin is greater than bidens advantages over trump on handling race relations 29 points health care 19 points and the coronavirus 17 points trump maintains his edge over biden in handling the economy but the margin declined from 10 points before the debate 48 percent to 38 percent to 7 points in the new poll 48 percent to 41 percent although that change is within the margin of sampling error trumps approval rating stands at 43 percent fortythree percent of registered voters approve of trumps job performance in the new poll which is down by 2 points from the last nbc newswsj poll fiftyfive percent disapprove of trumps job performance including 50 percent who say they strongly disapprove trumps favorability rating also dropped — from 41 percent positive52 percent negative before the debate 11 to 39 percent positive55 percent negative now 16 conversely the poll shows bidens favorability rating increasing — from 43 percent positive45 percent negative 2 to 43 percent positive41 percent negative after the debate 2 first numbers on trumps supreme court pick finally the poll asked voters about trumps pick to succeed the late ruth bader ginsburg on the supreme court amy coney barrett thirtyfive percent of registered voters say they support barretts nomination while 33 percent oppose it 30 percent say they dont know enough about her the findings are similar to the first nbc newswsj numbers on trumps 2018 supreme court pick brett kavanaugh whom the senate confirmed by a narrow 5048 vote in a separate question 50 percent of voters say they would prefer the senate to wait to fill the supreme court seat until theres a winner in the presidential contest while 38 percent want a vote before the election the nbc newswall street journal poll which was conducted sept 30oct 1 among 800 registered voters — more than half of whom were reached by cellphone — has an overall margin of error of plusminus 35 percentage points
